uid,nickname,time,star,comment
131407050,jd_150251jwow,2020-12-29 09:25:58,1,双十一买的，到这个月有一个多月了我来追加一下评论，当时买这个手机是在实体店看过的，因为他们说买电子产品在京东比较有保障，结果买回来用了之后出现了很多问题。首先在那天我收到手机的时候包装的盒子就没封好，快递员跟我说没事，后来是用了之后发现电池不耐用，一天基本没怎么玩，就聊聊~一天还得充一次电，起初我以为就是这种。今天我问了我同事，一样的机型，在玩了游戏的情况下，都可以一天半一充，不玩游戏基本可以两三天一充，所以我就在想是不是本身手机质量有问题还是中途被别人换了电池。其次还有一个问题就是面部识别有时候失灵。反正这是我第一次在京东购买电子产品，产品质量真的很堪忧。大家还是去店里面买比较保险。这都是华为京东直营店都出这种问题，说实在的真的很失望，以后都不会在京东买电子产品了。
385142904,j***3,2020-12-28 21:36:17,1,不是正品，大几千的手机问题一大堆，不敢在京东购物了
-1799989069,jd_152950see,2020-12-27 10:15:57,1,5G手机应该网速很快，但是这款手机我拿到手使用网速却特慢，不知道哪里出了问题
-2004581818,厌倦余温,2020-12-26 13:05:32,1,差评卡屏闪退有划痕还不给换货处理
外形外观：有划痕
屏幕音效：卡屏闪退
-1100296784,jd_136836xfyv,2020-12-26 11:19:21,1,什么破玩意，到现在还没收到货呢，都完成配送了，给谁了这是
-940245889,晴***头,2020-12-25 20:27:47,1,用了两个星期就卡死了，和用了三年的手机一样卡，以后再也不买华为。
-51568671,如雾如幻,2020-12-25 07:30:48,1,所有的一星都是给的爱回收和#，爱回收简直太烂，#和爱回收的客服互相推诿，以后再也不会用这个回收任何设备，千万别上当！
-439931284,jd_159753jem,2020-12-24 16:35:33,1,六千多，没用一个月，就出现了噪音闪屏，好垃圾
-1830867848,你***吻,2020-12-24 14:28:34,1,待机时间：待机五个小时左右，耗电去了百分之8这样子
运行速度：开机反正四十秒左右
现在因为质量问题退货了，一直售后检测一整天都没有结果的，太失望了。不单是售后慢，显示还会扣我8块钱上门取件，最差的购物体验。
-606803536,s***8,2020-12-23 16:08:27,1,差评！手机双11买的今天正式用。同时用了当时送的移动流量卡免费的，结果刚装上卡就收到短信欠费了。我根本不需要额外付费的流量卡而且要支付6个月的月租。真坑啊！
6309008,j***m,2020-12-23 15:24:31,1,用一周手机就有点卡，摄像拍出来的效果不是很好
-812374873,囧***8,2020-12-05 22:47:31,1,机器用过的
-1647286207,凯诗劳保**,2020-12-05 19:53:47,1,商品自身有质量问题还不给退货，
客服大言不惭说买家肉眼是看不到的，只有仪器可以检测出来，京东就是这么欺骗消费者嘛
1940178829,怪盗吖,2020-12-05 17:16:35,1,在直播间抽奖抽了无线充单天下单的 结果给我说中奖时间跟下单时间不符合
-1227051950,j***y,2020-12-05 08:54:30,1,死机卡死   刚买的新手机没有怎么用过   过了15天还不给换
-211007749,无***习,2020-12-04 21:55:51,1,屏幕音效：华为P40 Pro屏幕有三家供应商，京东方、LG、三星，很不幸，买到了体验最差的京东方屏幕，周冬雨排列，因为我有强迫症，肉眼发现屏幕上半部分偏绿，下半部分正常，去华为客户服务中心咨询，工作人员明确表示手机质量没有问题，并且表示是因为我心理原因。同样的价格，买到了屏幕不太理想的产品，这种抽奖的方式，着实让人不敢苟同。用了近7年华为的产品，手机手表平板电脑都有使用，但现在，我突然觉得有点心寒。手机我申请了退货，我接受不了这款产品的屏幕。不过我仍想说，华为加油。希望以后能真正使用到一款让我觉得满意的华为手机。
-100849534,逆天de存在,2020-12-04 10:51:32,1,第一次给差评！泄露****，专门打电话问是不是买了手机，推荐保修服务。
1543058669,陈***贞,2020-12-04 08:00:04,1,非常失望的一次购买，用了一个月换膜时才发现了屏幕有四个黑点，大家切记购买新机到手要撕掉原厂屏幕膜检查屏幕，因为贴上膜又看不到黑点了，刚好时间是31天，无法换新机，让我去线下维修，刚买一个月的手机，对这次线上购买，十分失望！
-993664503,ChenYang8866,2020-12-03 22:13:37,1,失望啊?，怎么会有屏闪
240995459,ggdd丶,2020-12-03 12:58:57,1,其他特色：手机一般，刚买一个星期这样就降价，也不能保价了，#。以后不会再买了！?
-315362982,Sivan-Jay,2020-12-03 02:47:14,1,说说最近一个多月的感受吧，最近一个多月在京东购买了一个小米自拍杆，一个飞利浦移动电源，一个欧乐B牙刷，一套资生堂，一部苹果12promax，一部华为p40pro。送货方面，以前京东不是都会打电话问下快递放在哪里的？怎么现在一言不合就给我放快递超市了？别的东西我就不说了，手机你们也敢放快递超市是么？你们不怕丢是么或者你们不怕丢了再赔付是么？或者丢了你们也不会赔？买的12promax也翻车了，这次售后体验是我经历的最差的一次，线下的质检报告我都放在里面了，检测个手机需要3天么？截止我写这条评论之前还在检测中，客服问了几次也什么没有解决，说有专门的的人跟踪这个事情，结果我连个电话都没收到，检测个毛线呢？最近这一个半月的物流服务加上这次的售后体验，让我之前对京东的的好感全无！！！！还plus会员，你告诉我这个会员有什么用么？会员都这种待遇，普通用户呢？糟糕的体验，以后这种贵重3C我也只能和京东说再见了，恭喜你们失去一个优质客户，反正你们也不差这一个客户是么？
1653711771,cKjVRrFbuFxt,2020-11-26 11:32:34,1,我也是服了
-1321316746,包子姐姐12,2020-11-26 10:48:42,1,只买一次，没有下次
1517820618,jd_wh熊,2020-11-26 08:42:07,1,运行速度：慢，跟ViVO21差不多，真后悔
-880490840,小英-1986,2020-11-25 23:12:53,1,我说刚出的时候买的也是这个价格。还送了原装充电器保温杯啥的。这个什么都没送也没便宜真是的醉了好生气#?
-849725189,简***k,2020-11-25 22:26:17,1,辣鸡视频不清楚模糊还说有多好直播太垃圾根本看不清差差差都别买都是坑切记！无语?好评应该都是刷出来的辣鸡?货辣鸡如果不想上当我劝大家不要买当然你们有钱就随便随便买那么烂还那么贵太#失望了辣鸡货垃圾垃圾垃圾坑坑坑坑坑
-1053751699,vi--vi-,2020-11-25 20:38:02,1,昨天买的还是5988，今天再看价格就是秒杀5799，京东永远都是这么坑吗？欺骗消费者
-825048921,掌上明灯,2020-11-25 13:42:42,1,质量极差，体验极差，通话有断音，通话自动挂机，售后只会反复强调三包，不理解买家切身感受、无助于解决消费者关心的问题，强烈要求退货！
-541510019,从***6,2020-11-25 09:47:57,1,中国华为真好  下次买苹果
175272686,157*****380_p,2020-11-25 08:17:35,1,服务态度没得说，都不在搭理你的，差差差
310620283,乙思,2020-11-24 23:26:58,1,#，垃圾华为，价格没有稳定，随意变动？！！都不带补差价的
